,Rank,Country,Year,COE_score,Farm,High_bid,Total_value,Company,Farmer/Rep.,Altitude,City,Region,Process,Clean_and_clear,Balance_cup,Transparent_cup,Creamy_body,Big_body,Long_aftertaste,Roasted_flavor,Spices_flavor,NuttyCocoa_flavor,Sweet_flavor,Floral_flavor,Fruity_flavor,GreenVegetative_flavor,Winey_flavor,Malic_acidity,Citric_acidity,Tartaric_acidity,Lactic_acidity,Complex_acidity,geisha,pacamara,catuai,caturra,bourbon,typica,sl-28,sl-34,colombia,74112,74110,74158,mixed_variety
113,25,Nicaragua,2017,86.08,Santa Prisca 2017,7.2,6789.6,Kyokuto Fadie Corporation,Leonel De Jesús Rodriguez Valladarez,,Dipilto,Nueva Segovia,washed,0,0,0,1,0,0,0,0,0,2,0,3,2,0,2,1,0,0,0,0,0,0,1,0,0,0,0,0,0,0,0,0
114,1,Nicaragua,2018,91.8,Finca La Bendicion – Finca La Bendicion,31.6,14288.57,"Maruyama Coffee (Japan), Sarutahiko Coffee (Japan), Good Boy Bob Coffee (U.S.A.)",Luis Alberto Balladarez Moncada,,Nueva Segovia,,natural,0,0,0,0,0,0,0,0,0,2,0,7,1,2,0,0,1,0,1,0,1,0,0,0,0,0,0,0,0,0,0,0
115,1,Nicaragua,2018,91.8,Finca La Bendicion – Finca La Bendicion,32.09,12734.27,Brew92 Cafe & Roastery,Luis Alberto Balladarez Moncada,,Nueva Segovia,,natural,0,0,0,0,0,0,0,0,0,2,0,7,1,2,0,0,1,0,1,0,1,0,0,0,0,0,0,0,0,0,0,0
116,2,Nicaragua,2018,90.42,Las Promesas de San Blas – Gonzalo Adán Castillo Moreno,15.3,7083.44,Rehm & Co. / Benecke Coffee GmbH & Co.,Gonzalo Adán Castillo Moreno,,Nueva Segovia,,honey,0,0,0,0,0,1,0,0,1,4,2,5,1,0,0,1,0,1,1,0,0,0,0,0,0,0,0,0,0,0,0,0
117,2,Nicaragua,2018,90.42,Las Promesas de San Blas – Gonzalo Adán Castillo Moreno,15.3,7083.44,"Time’s Club, Coffee Libre",Gonzalo Adán Castillo Moreno,,Nueva Segovia,,honey,0,0,0,0,0,1,0,0,1,4,2,5,1,0,0,1,0,1,1,0,0,0,0,0,0,0,0,0,0,0,0,0
118,3,Nicaragua,2018,90.38,Jesus Mountain – JESUS MOUNTAIN COFFEE COMPANY S.A,10.3,4087.35,"TOA COFFEE Co., Ltd.",JESUS MOUNTAIN COFFEE COMPANY S.A,,Nueva Segovia,,washed,0,0,0,1,0,1,0,0,1,1,2,9,2,1,1,0,0,1,0,0,1,0,0,0,0,0,0,0,0,0,0,0
119,3,Nicaragua,2018,90.38,Jesus Mountain 3b – JESUS MOUNTAIN COFFEE COMPANY S.A,10.2,3510.53,Campos Coffee,JESUS MOUNTAIN COFFEE COMPANY S.A,,Nueva Segovia,,washed,0,0,0,1,0,1,0,0,1,1,2,9,2,1,1,0,0,1,0,0,1,0,0,0,0,0,0,0,0,0,0,0
120,4,Nicaragua,2018,90.23,El Cambalache – Abner Samuel Zavala Gonzalez,9.6,4781.09,Kafferostare Per Nordby,Abner Samuel Zavala Gonzalez,,Nueva Segovia,,washed,1,0,0,0,0,0,0,0,1,2,1,5,1,1,0,1,1,0,0,0,0,0,1,0,0,0,0,0,0,0,0,0
121,4,Nicaragua,2018,90.23,El Cambalache – Abner Samuel Zavala Gonzalez,10.6,4907.48,HoneyCoffee (Izaki Coffee Co. Ltd),Abner Samuel Zavala Gonzalez,,Nueva Segovia,,washed,1,0,0,0,0,0,0,0,1,2,1,5,1,1,0,1,1,0,0,0,0,0,1,0,0,0,0,0,0,0,0,0
122,5,Nicaragua,2018,90.22,Un Regalo de Dios – Luis Alberto Balladarez Moncada,15.5,6150.87,"Adachi Coffee, Uchida Coffee, Maruyama Coffee",Luis Alberto Balladarez Moncada,,Nueva Segovia,,honey,0,1,0,0,0,0,0,0,2,5,0,11,0,0,0,0,1,0,0,0,1,0,0,0,0,0,0,0,0,0,0,0
123,5,Nicaragua,2018,90.22,Un Regalo de Dios – Luis Alberto Balladarez Moncada,15.31,6075.47,Single O,Luis Alberto Balladarez Moncada,,Nueva Segovia,,honey,0,1,0,0,0,0,0,0,2,5,0,11,0,0,0,0,1,0,0,0,1,0,0,0,0,0,0,0,0,0,0,0
124,6,Nicaragua,2018,89.55,La Virgen – Ramacafe (Grupo Hueck Poncon),7.5,10650.0,Dabov Specialty Coffee,RAMACAFE,,Matagalpa,,honey,0,0,0,0,0,0,0,0,0,2,2,8,0,0,1,0,0,0,0,0,0,0,0,0,0,0,0,0,0,0,0,0
125,7,Nicaragua,2018,89.03,El Manantial – Gloria Stella Lopez Moreno,7.65,7497.0,"Pebble Coffee Co., Ltd.",Gloria Stela Lopez Moreno,,Nueva Segovia,,washed,0,0,0,0,0,0,0,0,1,1,1,6,0,0,0,0,0,0,1,0,0,0,0,0,0,0,0,0,0,0,0,0
126,8,Nicaragua,2018,88.94,El Esfuerzo – Ignacio Estrada Burgo,9.1,7222.31,"Intelligentsia, George Howell Coffee, Ipsento, Onyx Coffee Lab,  Metric, Cafe Imports",Ignacio Estrada Burgo,,Jinotega,,washed,0,0,0,1,1,1,0,0,1,3,1,6,0,0,0,0,0,0,0,0,0,0,1,0,0,0,0,0,0,0,0,0
127,9,Nicaragua,2018,88.91,La Esperancita – Industrial Ganadera de Nicaragua S.A,7.9,7512.9,Kafema,Industrial Ganadera de Nicaragua S.A,,Matagalpa,,washed,0,0,0,0,0,0,0,0,0,1,0,9,0,0,0,1,1,0,1,0,0,0,0,0,0,0,0,0,0,0,0,0
128,10,Nicaragua,2018,88.67,Los Angeles – Heberto de Jesus Rivas,7.1,6915.4,Honu Kato Coffee Inc.,Heberto de Jesus Rivas,,Madriz,,washed,0,0,0,1,1,0,0,0,3,0,1,5,1,0,1,0,0,0,0,0,0,0,0,0,0,0,0,0,0,0,0,0
129,11,Nicaragua,2018,88.67,San Judas Estate – Jorge Luis Ferrey Machado,10.0,5260.0,Sulalat Coffee Trading,Jorge Luis Ferrey Machado,,Matagalpa,,natural,0,0,0,0,0,0,0,0,1,2,0,6,1,1,1,0,0,0,0,0,0,0,0,0,0,0,0,0,0,0,0,0
130,12,Nicaragua,2018,88.59,Las Nubes – Las Nubes S.A / Victor Robelo,9.1,7222.31,"TOA COFFEE Co., Ltd.",Las Nubes S.A,,Matagalpa,,natural,0,0,0,0,0,0,0,1,1,3,1,5,0,0,0,0,1,0,0,0,1,0,0,0,0,0,0,0,0,0,0,0
131,13,Nicaragua,2018,88.53,La Divina Providencia – Misael Sauceda Olivera,7.5,6598.73,Caravela Coffee,Misael Sauceda Olivera,,Nueva Segovia,,washed,0,0,0,0,0,0,0,1,1,1,0,8,1,0,1,1,0,0,0,0,0,0,0,0,0,0,0,0,0,0,0,0
133,15,Nicaragua,2018,88.44,El Recreo Estate – Leana José Machado De Ferrey,7.3,9730.9,Latorre and Dutch Coffee & Fisher Coffee,Leana José Machado De Ferrey,,Jinotega,,natural,0,0,0,0,0,1,0,0,1,0,0,4,0,1,0,1,0,0,1,0,0,0,0,0,0,0,0,0,0,0,0,0
134,16,Nicaragua,2018,88.42,La Ampliacion – Guillermo Montenegro Ayestas,6.5,6090.5,"Wataru & Co., Ltd.",Guillermo Montenegro Ayestas,,Nueva Segovia,,washed,0,0,0,0,0,0,0,0,0,2,1,8,0,1,2,0,0,1,0,0,0,0,1,0,0,0,0,0,0,0,0,0
135,17,Nicaragua,2018,88.41,El Destino – Erwin Obel Duartes Garcia,8.1,7938.0,Campos Coffee,Erwin Obel Duartes Garcia,,Jinotega,,washed,0,0,0,1,0,0,0,0,3,1,0,3,0,0,0,0,0,0,1,0,0,0,1,0,0,0,0,0,0,0,0,0
136,18,Nicaragua,2018,88.38,"La Bastilla – Cafetalera La Bastilla, S.A.",8.0,4432.0,Taylors of Harrogate,"Cafetalera La Bastilla, S.A.",,Jinotega,,washed,0,0,0,1,1,0,0,1,0,1,1,6,0,2,1,1,2,0,1,0,0,0,1,0,0,0,0,0,0,0,0,0
137,19,Nicaragua,2018,88.33,Las Pencas – Felix Pedro Siles Gadea,9.2,4867.72,Rehm & Co. / Benecke Coffee GmbH & Co.,Felix Pedro Siles Gadea,,Jinotega,,washed,0,0,0,1,0,0,0,0,1,1,1,4,0,0,0,0,0,1,0,0,1,0,0,0,0,0,0,0,0,0,0,0
138,20,Nicaragua,2018,88.27,Ojo de Agua – Luis Emilio Valladarez,12.2,11296.35,Ecom Japan Limited,Luis Emilio Valladarez,,Nueva Segovia,,washed,0,0,0,1,0,1,0,0,0,4,0,7,0,0,0,3,0,0,1,0,0,0,1,0,0,0,0,0,0,0,0,0
141,23,Nicaragua,2018,88.05,Las Morenitas – Las Morenitas S.A. / Victor Robelo,10.1,8877.9,Brew92 Cafe & Roastery,Las Morenitas S.A.,,Jinotega,,natural,0,0,0,0,0,0,0,0,0,3,1,4,0,0,0,1,0,0,0,0,0,1,0,0,0,0,0,0,0,0,0,0
142,24,Nicaragua,2018,88.05,La Rioja – Graciela Izayana Perez Bustos,5.7,8880.6,Honu Kato Coffee Inc.,Graciela Izayana Perez Bustos,,Jinotega,,honey,0,0,0,0,0,1,0,0,2,2,0,4,0,0,1,0,0,0,0,0,0,0,0,1,0,0,0,0,0,0,0,0
143,25,Nicaragua,2018,87.89,"San Jose – MIMC S, A",5.9,5728.9,"Wataru & Co., Ltd.","MIMC S,A",,Jinotega,,honey,0,0,0,0,0,0,0,0,0,2,1,3,0,0,0,0,1,0,0,0,0,0,0,0,0,0,0,0,0,0,0,0
144,26,Nicaragua,2018,87.78,Santa Teresa – Jorge Luis Lagos Calix,6.6,6705.6,Kyokuto Fadie Corporation,Jorge Luis Lagos Calix,,Nueva Segovia,,washed,0,0,0,0,0,0,0,0,3,4,1,8,1,1,1,1,0,0,0,0,0,0,1,0,0,0,0,0,0,0,0,0
145,27,Nicaragua,2018,87.78,San Ramon – Alfredo Rene Lopez Gomez,6.8,5630.4,Nippon Coffee Trading,Alfredo Rene Lopez Gomez,,Nueva Segovia,,washed,0,0,0,0,0,0,0,1,2,4,0,4,0,1,1,1,0,0,0,0,0,0,1,0,0,0,0,0,0,0,0,0
146,28,Nicaragua,2018,87.75,Santa Prisca – Leonel De Jesús Rodríguez Valladarez,6.8,6746.08,"Wataru & Co., Ltd.",Leonel De Jesús Rodríguez Valladarez,,Nueva Segovia,,washed,0,0,0,0,0,1,0,0,2,2,1,6,0,0,0,0,0,0,0,0,0,0,1,0,0,0,0,0,0,0,0,0
147,29,Nicaragua,2018,87.38,Los Pirineos – Eudoro José Guillén Jarquín,5.6,4814.82,"Wataru & Co., Ltd.",Eudoro José Guillén Jarquín,,Nueva Segovia,,washed,0,0,0,0,0,0,0,1,0,1,2,6,0,0,0,2,0,0,0,0,0,0,1,0,0,0,0,0,0,0,0,0
149,31,Nicaragua,2018,87.09,La Bendicion – Jose Liberato Jarquin Agurcia,5.9,4526.48,Honu Kato Coffee Inc.,Jose Liberato Jarquin Agurcia,,Nueva Segovia,,washed,0,0,0,0,0,0,0,0,0,2,0,5,1,0,0,0,0,0,0,0,0,0,1,0,0,0,0,0,0,0,0,0
151,33,Nicaragua,2018,86.8,Buena Esperanza – Agricola Rajuanse S.A,5.5,5820.16,"Wataru & Co., Ltd.",Agricola Rajuanse S.A,,Matagalpa,,washed,0,0,0,0,0,0,0,1,2,1,0,3,0,0,1,3,0,0,1,0,1,0,0,0,0,0,0,0,0,0,0,0
172,1,Nicaragua,2021,90.96,Jesus Mountain Coffee Company,25.1,25730.76,"Orsir Coffee Co., Ltd. & GoodBoyBob",Jesus Mountain Coffee,1850.0,,,washed,0,0,0,0,0,1,0,0,4,4,1,17,0,0,1,4,0,0,1,0,1,0,0,0,0,0,0,0,0,0,0,0
173,1,Nicaragua,2021,90.96,Jesus Mountain Coffee Company,25.9,26550.87,"Time’s Club, Coffee Libre, Nylon coffee roasters, BREW & BREAD COFFEE ROASTER, Brave Roasters, Valley Coffee(China), EL CAFE coffee roasters, Told a story, das ist PROBAT, Coffee Montage, 304 roasters, COFFEE PLACE, liike coffee, Songdo Coffee, Coffee Me Up (Korea)",Jesus Mountain Coffee,1850.0,,,washed,0,0,0,0,0,1,0,0,4,4,1,17,0,0,1,4,0,0,1,0,1,0,0,0,0,0,0,0,0,0,0,0
174,2,Nicaragua,2021,90.75,El Cambalache,30.2,6990.7,Dimattina Coffee,Abner Samuel Zavala/Indira Paola Zavala,1450.0,,,honey,0,0,0,0,1,0,0,0,4,6,3,13,1,0,2,3,2,0,1,0,0,0,1,0,0,0,0,0,0,0,0,0
175,2,Nicaragua,2021,90.75,El Cambalache,30.3,7013.84,Kyokuto Fadie Corporation,Abner Samuel Zavala/Indira Paola Zavala,1450.0,,,honey,0,0,0,0,1,0,0,0,4,6,3,13,1,0,2,3,2,0,1,0,0,0,1,0,0,0,0,0,0,0,0,0
176,3,Nicaragua,2021,90.21,Los Pirineos,27.95,7394.17,Sulalat Coffee Trading,Eudoro Jose Guillen Jarquin,1380.0,,,natural,0,0,0,0,0,0,1,2,2,7,2,12,1,1,0,2,3,0,0,0,0,1,0,0,0,0,0,0,0,0,0,0
177,3,Nicaragua,2021,90.21,Los Pirineos,27.7,7328.04,"L’escargot d’or cosmetocafe, Rogue Wave Coffee, Rehm & Co., Molecular Coffee",Eudoro Jose Guillen Jarquin,1380.0,,,natural,0,0,0,0,0,0,1,2,2,7,2,12,1,1,0,2,3,0,0,0,0,1,0,0,0,0,0,0,0,0,0,0
178,4,Nicaragua,2021,90.11,Auxilio Mundial,24.1,14194.9,Latorre & Dutch Coffee (China) for Fisher Coffee / MANNER COFFEE (China) / 芦田家咖啡研习社 / CCRA (手工烘焙咖啡协会) / PENGUIN MARKET,Norman Alexis Canales Sevilla,1700.0,,,washed,0,0,0,0,0,0,0,0,1,3,5,5,1,0,2,4,1,0,0,1,0,0,0,0,0,0,0,0,0,0,0,0
179,5,Nicaragua,2021,89.96,Buenos Aires,23.1,13259.4,Ecom Japan Limited,Invasa,1350.0,,,natural,0,0,0,0,0,0,0,3,4,4,1,12,0,2,1,2,1,0,0,0,0,0,0,0,0,0,0,0,0,0,0,0
180,6,Nicaragua,2021,89.79,Un Regalo de Dios,23.0,10648.08,Giv Coffee,Luis Alberto Balladarez Moncada,1450.0,,,natural,0,0,0,0,1,0,0,2,0,5,0,17,0,0,1,1,2,0,1,0,0,0,1,0,0,0,0,0,0,0,0,0
181,7,Nicaragua,2021,89.71,San Jose,20.6,9536.98,Sulalat Coffee Trading,Silvia Esther Jarquin Agurcia,1300.0,,,natural,0,1,0,0,0,0,0,2,0,2,2,16,1,3,0,5,0,0,0,0,0,0,1,0,0,0,0,0,0,0,0,0
182,8,Nicaragua,2021,88.79,La Picona,20.0,9020.0,"Wataru & Co., Ltd.",Olga Marina Gonzalez Cuadra,1400.0,,,honey,0,0,0,0,0,0,0,0,0,5,4,9,2,0,0,4,1,0,0,0,0,0,1,0,0,0,0,0,0,0,0,0
183,9,Nicaragua,2021,88.11,La Orquidea,20.2,8948.6,Latorre & Dutch Coffee (China) for Fisher Coffee,Arjen Roersman,1400.0,,,washed,0,0,0,0,0,0,0,1,3,8,1,5,2,1,2,1,1,0,0,0,0,0,1,0,0,0,0,0,0,0,0,0
184,10,Nicaragua,2021,88.04,Santa Ana,17.2,5687.7,Kyokuto Fadie Corporation,Aida Lila Zeledon Palacios,1250.0,,,washed,0,1,0,0,0,0,0,1,4,4,1,6,0,0,0,3,0,0,1,0,0,0,0,0,0,0,0,0,0,0,0,0
185,11,Nicaragua,2021,87.79,Melanie,11.0,21604.0,Honu Kato Coffee Inc.,Veronica Victoria Jarquin Lopez,1400.0,,,honey,1,0,0,0,0,0,0,3,4,3,0,11,1,1,0,2,1,0,0,0,0,1,0,0,0,0,0,0,0,0,0,0
186,12,Nicaragua,2021,87.54,La Porra,10.1,9069.8,Nagahama Coffee Inc.,Bayron Antonio Ocon Ubeda,1220.0,,,washed,0,0,0,0,0,0,0,0,2,8,0,8,1,0,0,5,0,0,1,0,0,0,0,0,0,0,0,0,0,0,0,0
187,13,Nicaragua,2021,87.54,Los Milagros,20.1,7517.4,Latorre & Dutch Coffee (China) for Fisher Coffee / 领地 La Finca / MANNER COFFEE (China),Inversiones y desarrollo mozonte,1350.0,,,honey,0,0,0,0,0,0,0,0,1,3,4,1,3,0,1,4,0,0,0,0,0,0,0,0,1,0,0,0,0,0,0,0
188,14,Nicaragua,2021,87.5,El Principe,11.0,15277.68,"GSC International Co., Ltd.",José Victor Lopez Urroz,1500.0,,,honey,0,0,0,0,0,0,0,0,3,6,3,7,0,1,0,0,2,0,0,0,0,0,0,0,0,0,0,0,0,0,0,0
189,15,Nicaragua,2021,87.5,Las Hortensias,10.5,5208.0,Thood Qahwa LTD Co,Ana Marina Albir,1200.0,,,natural,0,0,0,0,0,0,0,1,3,5,1,11,0,0,1,4,2,0,0,0,0,1,0,0,0,0,0,0,0,0,0,0
190,16,Nicaragua,2021,87.38,Fila Quemada,10.1,12023.75,"Wataru & Co., Ltd.",Rony Jose Herrera Ortez,1525.0,,,washed,0,0,0,0,0,0,0,1,1,3,2,8,0,0,1,4,0,0,0,0,0,1,0,0,0,0,0,0,0,0,0,0
191,17,Nicaragua,2021,87.33,Santa Carmela,20.1,7457.1,Latorre & Dutch Coffee (China) for Fisher Coffee,Tania Gabriela Ferrufino Norori,1350.0,,,anaerobic,0,0,0,0,0,0,0,0,0,3,3,4,2,0,2,5,0,0,0,0,0,0,0,0,0,0,0,0,0,0,0,0
192,18,Nicaragua,2021,87.25,El Poste,10.3,23669.4,"Wataru & Co., Ltd.",Guillermo Montenegro,1300.0,,,washed,0,0,0,0,0,1,0,0,2,5,3,5,2,0,2,2,1,0,0,0,0,1,1,1,0,0,0,0,0,0,0,1
193,19,Nicaragua,2021,87.25,Buena Esperanza,13.2,13754.4,List + Beisler GmbH,Agrícola Rajuanse/ Ramiro Ortiz Gurdian,1150.0,,,natural,0,0,0,0,0,0,0,0,3,6,1,4,2,0,0,4,0,0,0,0,0,0,0,0,0,0,0,0,0,0,0,0
194,20,Nicaragua,2021,87.25,La Esperanza,9.2,3650.74,Mokka Specialty Coffee,Rosa Yanette Rivera Siles,1200.0,,,washed,0,0,0,0,0,0,0,0,6,6,0,6,1,0,1,3,0,0,0,0,0,1,1,0,0,0,0,0,0,0,0,1
195,21,Nicaragua,2021,87.21,Buena Vista,14.7,4645.2,Kyokuto Fadie Corporation,German Odorico Cortez,1200.0,,,washed,0,0,0,0,0,0,1,1,4,2,1,7,0,0,2,3,0,0,0,0,0,1,0,0,0,0,0,0,0,0,0,0
196,22,Nicaragua,2021,87.21,Los Altiplanos,11.2,6339.2,Wataru for OGAWA COFFEE,Ricardo Cuadra Fajardo,1300.0,,,natural,0,0,0,0,0,0,0,0,3,4,0,7,2,0,1,2,1,0,0,0,1,0,0,0,0,0,0,0,0,0,0,0
197,23,Nicaragua,2021,87.0,Las Brumas,9.9,7137.9,Ecom Japan Limited,Jose Rene Paguaga Midence,1400.0,,,washed,0,0,0,1,0,0,0,0,4,5,0,5,1,0,0,1,0,0,0,0,0,0,1,0,0,0,0,0,0,0,0,0
198,1,Nicaragua,2022,90.74,El Avión,25.2,6667.92,Times Club & Coffee Libre,Mario José González Rodríguez,,,,natural,0,0,0,1,0,0,0,2,2,7,4,23,1,1,4,5,2,0,1,0,0,1,0,0,0,0,0,0,0,0,0,0
199,1,Nicaragua,2022,90.74,El Avión,23.5,5933.75,"Snow Beans Coffee, Japan Roasters Community, Adachi Coffee Inc. by Maruyama Coffee",Mario José González Rodríguez,,,,natural,0,0,0,1,0,0,0,2,2,7,4,23,1,1,4,5,2,0,1,0,0,1,0,0,0,0,0,0,0,0,0,0
200,2,Nicaragua,2022,89.65,Buenos Aires,8.0,3416.0,"Bokkum & Gil coffee Roasters, Comansa, Oraund Coffee",Invasa,,,,natural,0,0,0,0,0,0,0,0,1,4,5,18,0,2,1,3,2,0,0,0,0,0,1,0,0,0,0,0,0,0,0,0
201,3,Nicaragua,2022,89.53,Un Regalo De Dios,17.3,8719.2,"𝐿𝐸𝐴𝑉𝐸𝑆 𝐶𝑂𝐹𝐹𝐸𝐸 𝑅𝑂𝐴𝑆𝑇𝐸𝑅𝑆, WAVY COFFEE ROASTERS, ETHICUS coffee roasters and Acid Coffee Tokyo by Marukai",Luis Alberto Balladarez Moncada,,,,natural,1,0,1,0,0,1,0,0,3,5,2,21,2,0,1,6,1,0,0,0,0,0,1,0,0,0,0,0,0,0,0,0
202,4,Nicaragua,2022,89.35,Los Volcancitos,25.1,10190.6,Kyokuto Fadie Corporation,Sergio Antonio Gutiérrez Peralta,1750.0,,,washed,0,0,0,1,0,0,0,0,6,12,4,19,2,0,1,3,1,0,0,0,1,1,0,0,0,0,0,0,0,0,0,1
203,5,Nicaragua,2022,89.0,Bella Aurora,12.1,4779.5,"Orsir International Co., Ltd.",Luis Joaquín Lovo Gutiérrez,,,,washed,0,0,0,0,0,0,0,1,5,6,2,25,2,0,2,3,0,0,0,0,0,0,1,0,0,0,0,0,0,0,0,0
204,6,Nicaragua,2022,88.91,La Soledad,7.5,3697.5,"Wataru & Co., Ltd.",Daisy María Zamora Mansell,1350.0,,,natural,0,0,0,1,0,0,0,1,6,5,0,19,1,4,3,5,1,0,0,0,0,0,1,0,0,0,0,0,0,0,0,0
205,7,Nicaragua,2022,88.76,El Cambalache,8.1,3701.7,Studio Caffeine,Abner Samuel Zavala Gonzalez,,,,honey,0,0,0,0,0,1,0,2,5,7,2,18,1,0,1,6,0,0,0,0,0,0,1,0,0,0,0,0,0,0,0,0
206,8,Nicaragua,2022,88.76,Jesús Mountain Coffee Company,17.7,20124.9,Campos Coffee,Jesús Mountain Coffee Company,,,,washed,0,0,0,0,0,0,0,0,5,7,3,17,2,0,0,5,0,0,0,0,1,0,0,0,0,0,0,0,0,0,0,0
207,9,Nicaragua,2022,87.94,La Orquídea,10.8,6469.2,TAKAMURA COFFEE ROASTERS by Marukai,Arjen Roersma,1400.0,,,washed,0,0,0,0,0,0,0,0,3,3,2,12,1,0,1,4,0,0,0,0,0,0,1,0,0,0,0,0,0,0,0,0
208,10,Nicaragua,2022,87.94,Los Suyates,7.0,3073.0,"Wataru & Co., Ltd.",Jairo Rogelio Vásquez Olivera,,,,natural,0,0,0,0,0,0,0,1,2,2,1,18,1,0,0,3,0,0,0,0,0,1,0,0,0,0,0,0,0,0,0,0
209,11,Nicaragua,2022,87.76,Las Termópilas,5.2,9074.0,"Wataru & Co., Ltd.",Milton Daniel Canales Sevilla,,,,washed,1,0,0,1,0,0,0,1,5,4,1,14,1,0,1,6,0,1,0,0,0,0,1,1,0,0,0,0,0,0,0,1
210,12,Nicaragua,2022,87.71,El Porvenir,5.8,3010.2,"GSC International Co., Ltd",Claudia María Rivera Siles,1350.0,,,natural,0,0,1,0,0,0,0,1,4,1,3,17,2,0,3,5,0,0,0,0,0,0,1,0,0,0,0,0,0,0,0,0
211,13,Nicaragua,2022,87.59,La Bendicion,6.8,2883.2,"Wataru & Co., Ltd.",José Liberato Jarquín,,,,natural,0,0,0,0,0,0,0,1,0,2,1,20,0,1,2,1,1,0,0,0,0,1,1,1,0,0,0,0,0,0,0,1
212,14,Nicaragua,2022,87.56,Libertad,6.1,3806.4,Kyokuto Fadie Corporation,Danny Joél Pastrana Gómez,1600.0,,,washed,0,0,0,0,0,1,0,0,2,3,1,9,1,0,1,4,0,0,1,0,0,0,1,0,0,0,0,0,0,0,0,0
213,15,Nicaragua,2022,87.53,Divina Providencia,5.2,4035.2,"Wataru & Co., Ltd.",Misael Sauceda Olivera,,,,others_process,0,0,0,1,0,0,1,1,5,7,1,14,4,0,1,4,0,0,0,0,0,0,0,0,0,0,0,0,0,0,0,0
214,16,Nicaragua,2022,87.41,Las Pavas,5.2,3946.8,"Wataru & Co., Ltd.",Ricardo Gutiérrez Mendoza,,,,washed,0,0,0,1,0,0,2,0,7,7,1,13,0,0,1,2,0,0,0,0,0,0,0,0,0,0,0,0,0,0,0,0
215,17,Nicaragua,2022,87.41,La Esperanza,5.8,2923.2,"Wataru & Co., Ltd.",Olga Marina González / Indira Paola Zavala,1500.0,,,honey,0,0,0,0,0,0,0,0,4,4,1,12,3,1,2,4,0,0,0,0,0,0,1,0,0,0,0,0,0,0,0,0
216,18,Nicaragua,2022,87.35,Los Pirineos,5.9,2560.6,"THE DRIP CO.,LTD",Eudoro José Guillén Jarquín,,,,natural,0,0,0,0,0,0,0,1,5,6,0,14,1,0,0,2,0,0,0,0,0,0,1,0,0,0,0,0,0,0,0,0
217,19,Nicaragua,2022,87.32,El Recuerdo,5.6,2156.0,Wataru for OGAWA COFFEE,Norma Elisa Flores Miranda,,,,natural,0,0,0,0,0,0,0,2,1,4,1,10,1,1,0,3,1,0,0,0,0,0,1,0,0,0,0,0,0,0,0,0
218,20,Nicaragua,2022,87.26,El Chele,7.3,3087.9,"Wataru & Co., Ltd.",Norman Alexander Torres Rivera,,,,natural,0,0,0,0,0,0,0,0,1,3,0,14,2,0,0,3,0,0,0,0,0,1,0,0,0,0,0,0,0,0,0,0
219,21,Nicaragua,2022,87.18,Los Cuadros,5.6,1825.6,"Wataru & Co., Ltd.",Rosa Ines Rubio,1400.0,,,natural,0,0,0,0,0,0,0,1,5,6,2,13,1,1,0,2,1,0,0,0,0,0,1,0,0,0,0,0,0,0,0,0
220,22,Nicaragua,2022,87.15,El Poste,5.1,4544.1,honu加藤珈琲店株式会社,Guillermo Montenegro Ayesta,,,,washed,0,0,0,0,0,0,1,1,5,4,1,10,0,0,2,4,1,0,0,0,0,1,0,0,0,0,0,0,0,0,0,0
221,23,Nicaragua,2022,87.12,Ufcm,7.0,2268.0,MOKKA COFFEE,Mayra Lucila Corrales Rivas,1450.0,,,washed,0,1,0,0,0,0,1,0,5,8,0,11,2,0,0,2,0,0,0,0,0,0,0,0,0,0,0,0,0,0,0,0
222,24,Nicaragua,2022,87.12,Bethania,7.1,3571.3,Kyokuto Fadie Corporation,Martha Lucia Albir,,,,honey,0,1,0,0,0,0,1,0,9,5,1,12,1,0,1,2,1,0,0,0,0,0,1,0,0,0,0,0,0,0,0,0
223,25,Nicaragua,2022,87.12,Viento Del Espiritu Santo,7.3,4109.9,Linking Coffee,Michael Low,,,,natural,0,0,0,0,0,0,0,0,1,4,1,9,3,0,1,1,0,1,0,0,0,0,0,0,0,0,0,0,0,0,0,0
224,26,Nicaragua,2022,87.09,Puma Punkú,5.2,2319.2,Wataru for Voila Coffee,Manuel Rosales Raudales,,,,washed,0,0,0,0,0,0,0,1,2,5,2,12,1,0,2,4,1,0,0,0,0,1,1,1,0,0,0,0,0,0,0,1
225,1,Nicaragua,2023,91.6,LOS ALPES,73.5,16286.87,"Snow Beans Coffee – Japan, YN Coffee, WAVY COFFEE",Inversiones Valladarez Acevedo S.A,1600.0,,,natural,0,0,0,0,0,0,0,0,2,5,7,22,3,0,2,0,1,0,1,1,0,0,0,0,0,0,0,0,0,0,0,0
226,1,Nicaragua,2023,91.6,LOS ALPES,80.1,15893.44,"NOZY COFFEE, manucoffee, hugcoffee, ocami coffee – Japan",Inversiones Valladarez Acevedo S.A,1600.0,,,natural,0,0,0,0,0,0,0,0,2,5,7,22,3,0,2,0,1,0,1,1,0,0,0,0,0,0,0,0,0,0,0,0
227,2,Nicaragua,2023,90.25,BUENOS AIRES,53.5,17633.07,PRIVATE RESERVE (China) /玫瑰咖啡ROSE CAFÉ/ 乜早咖啡 / 乐否咖啡 Leforkaffe,Inversiones Valladarez Acevedo S.A,1400.0,,,natural,0,0,0,0,0,0,0,2,3,3,2,22,2,4,2,2,0,0,0,0,0,0,1,0,0,0,0,0,0,0,0,0
228,2,Nicaragua,2023,90.25,BUENOS AIRES,60.1,11925.04,NOZY COFFEE – Japan,Inversiones Valladarez Acevedo S.A,1400.0,,,natural,0,0,0,0,0,0,0,2,3,3,2,22,2,4,2,2,0,0,0,0,0,0,1,0,0,0,0,0,0,0,0,0
229,3,Nicaragua,2023,89.45,SANTA CRUZ,20.8,12958.4,SARUTAHIKO COFFEE – Japan,Sara Isabel Corrales Rivas,1450.0,,,honey,0,0,0,0,0,0,0,0,1,4,2,18,0,3,0,1,2,0,1,0,0,0,1,0,0,0,0,0,0,0,0,0
230,4,Nicaragua,2023,89.3,JESUS MOUNTAIN COFFEE,8.2,17897.07,"Coffee Libre – South Korea Times Club, Japan. – Nylon Coffee Roasters.","Jesús Mountain Coffee Company Nicaragua, S.A",1450.0,,,others_process,0,0,0,0,0,0,0,2,3,2,1,15,1,0,1,0,1,0,1,0,1,0,0,0,0,0,0,0,0,0,0,0
231,5,Nicaragua,2023,88.9,EL CAMBALACHE,17.3,8650.0,SHRUB COFFEE by Marukai,Abner Samuel Zavala González,1450.0,,,natural,0,0,0,0,0,0,0,0,3,4,3,22,0,2,0,1,1,0,1,0,0,0,1,0,0,0,0,0,0,0,0,0
232,6,Nicaragua,2023,88.5,UN REGALO DE DIOS,13.1,7729.0,"YOKOI COFFEE, YAMADA COFFEE, Sugi Coffee Roasting, Japan Roasters’ Network",Luis Alberto Balladres,1350.0,,,natural,0,0,0,1,0,0,0,0,4,4,2,15,0,0,2,0,1,0,0,0,1,0,0,0,0,0,0,0,0,0,0,0
233,7,Nicaragua,2023,88.25,QUITASUEÑOS,7.2,5140.8,"Wataru & Co., Ltd. – Japan",Exportadora Atlantic S.A,900.0,,,others_process,0,0,0,0,0,0,1,1,8,1,1,17,4,1,2,1,0,0,0,0,0,0,0,0,0,0,0,0,0,0,0,0
234,8,Nicaragua,2023,88.1,COFFEE LIBRE S.A.,70.2,35451.0,DECAMERON COFFEE – China,Coffe Libre S.A,1650.0,,,washed,0,0,0,1,0,0,0,1,4,2,3,16,0,0,1,3,1,0,0,1,0,0,0,0,0,0,0,0,0,0,0,0
235,9,Nicaragua,2023,88.0,LA ORQUIDEA,15.2,9788.8,Wataru for Voila Coffee,Argen Roesma,1400.0,,,washed,0,0,0,0,0,0,2,2,8,2,1,12,1,0,3,1,1,0,0,0,0,0,1,0,0,0,0,0,0,0,0,0
236,10,Nicaragua,2023,87.95,EL PORVENIR,7.0,3920.0,"Wataru & Co., Ltd. – Japan",Martha Margarita Marin Rodriguez,1500.0,,,washed,0,0,0,0,0,0,0,1,10,6,2,10,1,1,1,1,2,0,0,0,0,0,0,0,0,0,0,0,0,0,0,0
237,11,Nicaragua,2023,87.35,BUENA ESPERANZA,10.5,5555.66,1895 by Lavazza – Italy,Agricola Rajuanse S.A.,1150.0,,,natural,0,0,0,0,0,0,1,0,5,3,4,20,2,0,1,1,0,1,0,0,0,0,0,0,0,0,0,0,0,0,0,0
238,12,Nicaragua,2023,87.3,LA PICONA,7.2,4233.6,M.I.Coffee Corporation – South Korea,Olga Marina González,1400.0,,,washed,0,0,0,0,0,0,0,1,3,0,2,15,3,0,1,0,2,1,0,0,0,0,1,0,0,0,0,0,0,0,0,0
239,13,Nicaragua,2023,87.25,EL PROGRESO,7.5,3660.0,COFFEE COUNTY – Japan,Jairo Omar González,1650.0,,,washed,0,0,0,0,0,0,0,1,5,3,2,18,0,0,1,0,0,0,1,0,0,0,0,0,0,0,0,0,0,0,0,0
240,14,Nicaragua,2023,87.0,MONTESOL,7.8,12300.6,"Wataru & Co., Ltd. – Japan",Jaime Antonio Rosales Pasquier,1200.0,,,natural,0,0,0,0,0,0,0,1,5,3,2,18,0,0,1,0,0,0,1,0,1,0,0,0,0,0,0,0,0,0,0,0
241,15,Nicaragua,2023,87.0,LA AURORA,7.0,3584.0,"Wataru & Co., Ltd. – Japan",Mario José Gonzalez Morazan,1600.0,,,washed,0,0,0,0,0,0,1,0,4,4,1,15,3,0,1,4,1,1,0,0,0,1,0,0,0,0,0,0,0,0,0,0
242,16,Nicaragua,2023,87.0,LA HACIENDA,5.6,4256.0,"Wataru & Co., Ltd. – Japan",María Dolores Rodríguez López,1500.0,,,washed,0,0,0,0,0,0,0,2,10,7,5,12,0,0,1,1,0,0,0,0,0,0,1,0,0,0,0,0,0,0,0,0
