,Rank,Country,Year,COE_score,Farm,High_bid,Total_value,Company,Farmer/Rep.,Altitude,City,Region,Process,Clean_and_clear,Balance_cup,Transparent_cup,Creamy_body,Big_body,Long_aftertaste,Roasted_flavor,Spices_flavor,NuttyCocoa_flavor,Sweet_flavor,Floral_flavor,Fruity_flavor,GreenVegetative_flavor,Winey_flavor,Malic_acidity,Citric_acidity,Tartaric_acidity,Lactic_acidity,Complex_acidity,geisha,pacamara,catuai,caturra,bourbon,typica,sl-28,sl-34,colombia,74112,74110,74158,mixed_variety
0,1,Nicaragua,2012,92.43,Las Golondrinas,22.4,48889.12,"Busan Group – Momos Coffee, In Earth Coffee, Coffee Gongjang, People n Talk",Rodrigo Peralta Paguaga,1600.0,Mozonte,Nueva Segovia,others_process,1,1,0,0,0,0,0,2,2,5,2,5,0,0,0,0,1,0,0,0,0,0,1,0,0,0,0,0,0,0,0,0
1,2,Nicaragua,2012,90.4,La Divina Providencia,15.0,35714.85,"Maruyama Coffee, Cafe Maple (Japan) and Orsir Coffee (Taiwan)",Misael Sauceda Olivera,1300.0,Dipilto-Las Manos,Nueva Segovia,washed,1,0,0,0,0,0,0,1,1,2,2,3,0,0,1,1,0,0,0,0,0,0,0,0,0,0,0,0,0,0,0,0
2,3,Nicaragua,2012,90.2,El Farallón/ El Naranjo,10.0,23809.9,TERAROSA(HAKSAN Co.Ltd),Rómulo Victor Paguaga Lanzas/ Pedro Pablo Paguaga Nuñez,1300.0,Dipilto-La Laguna,Nueva Segovia,others_process,1,0,0,1,1,0,0,0,1,2,1,2,0,0,0,1,1,0,0,0,0,0,1,0,0,0,0,0,0,0,0,0
3,4,Nicaragua,2012,89.97,La Marcela,8.6,19907.71,Time’s Club for C-COOP. Your Coffee (Japan) Coffee Libre (South Korea),Mario Martin Lovo Sotomayor,1100.0,Macuelizo-Brujil,Nueva Segovia,others_process,1,0,0,0,0,1,0,0,0,2,0,5,0,0,0,1,0,0,0,0,0,0,1,0,0,0,0,0,0,0,0,0
4,5,Nicaragua,2012,89.93,La Carolina,7.7,20370.74,Mayorga Coffee,Andrés Figueroa Lópes,1318.0,Dipilto-Las Nubes,Nueva Segovia,washed,0,1,0,1,1,1,0,1,1,0,1,6,1,0,0,2,1,0,0,0,0,0,0,0,0,0,0,0,0,0,0,0
5,6,Nicaragua,2012,89.67,El Recodo,6.81,16214.54,"Tashiro Coffee Co.,Ltd",Manuel Raúl Gonzáles Gonzáles,1230.0,Macuelizo-Suyatal,Nueva Segovia,washed,0,1,0,0,0,1,0,0,2,4,1,3,0,0,0,1,1,0,0,0,0,0,1,1,0,0,0,0,0,0,0,1
6,7,Nicaragua,2012,89.57,Santa Elena,6.78,16591.54,Mocoway Specialty Coffee (China),Santos Filomena Grádiz Amaya,1200.0,Dipilto-El Volcán,Nueva Segovia,others_process,1,1,0,0,0,1,0,1,1,2,0,6,0,0,0,1,0,0,1,0,0,0,1,0,0,0,0,0,0,0,0,0
7,8,Nicaragua,2012,88.83,Ojo De Agua,6.7,16395.77,"ECOM Japan Limited for Bontain Coffee, VOILA Coffee, NOZY COFFEE, Ocami Coffee Roasters, Kasai Coffee",Luis Emilio Valladarez,1600.0,Dipilto-Los Mares,Nueva Segovia,others_process,1,1,0,0,0,0,0,0,4,3,1,3,0,0,0,1,0,0,0,0,0,0,1,0,0,0,0,0,0,0,0,0
8,9,Nicaragua,2012,88.53,San Francisco/ El Ayote,6.41,16957.98,"Wataru & Co., Ltd.",Fausto Alberto Averruz Ponce/Fausto Alberto Averrauz González,1250.0,Macuelizo-Suyatal,Nueva Segovia,washed,0,0,0,0,0,0,0,0,3,2,0,4,0,0,0,1,1,0,0,0,0,0,0,0,0,0,0,0,0,0,0,0
9,10,Nicaragua,2012,88.13,Casa Blanca,7.92,18857.44,Kyokuto Fadie Corporation,Sergio Noé Ortez Ortez,1300.0,Dipilto-Los Planes,Nueva Segovia,others_process,0,0,0,0,0,1,0,2,1,3,1,6,0,0,0,0,1,0,0,0,1,0,0,0,0,0,0,0,0,0,0,0
10,11,Nicaragua,2012,87.69,Linda Vista,6.6,15714.53,"BeanStore, CoffeeSallim, Yun-Gu Lee Roaster, Beon-Ku Jeon Roaster",Francisco González Avilés,1460.0,Dipilto-Las Nubes,Nueva Segovia,others_process,1,0,0,0,0,0,0,0,2,2,1,7,1,0,0,1,0,0,0,0,0,0,1,0,0,0,0,0,0,0,0,0
11,12,Nicaragua,2012,87.44,"El Naranjo, Dipilto",7.32,17912.99,Wataru for OGAWA COFFEE,Luis Emilio Valladarez,1100.0,Dipilto-El Guácimo,Nueva Segovia,others_process,1,1,0,0,1,0,0,2,1,1,1,5,0,0,0,1,1,0,0,0,0,0,1,0,0,0,0,0,0,0,0,0
12,13,Nicaragua,2012,87.28,Los Jilgueros,6.51,15930.82,"Wataru & Co., Ltd.",Manuel Armando Peralta Paguaga,1250.0,Macuelizo-Brujil,Nueva Segovia,others_process,0,0,0,1,0,0,0,0,1,3,1,10,1,0,0,1,0,0,0,0,0,0,1,0,0,0,0,0,0,0,0,0
13,14,Nicaragua,2012,87.22,Las Nubes,6.7,17282.05,"M.I Coffee Corporation, Indie coffee roasting house, Hanjuha’s coffee",Carlos Alberto Bendaña Albir,1500.0,Dipilto,Nueva Segovia,others_process,0,1,0,0,0,0,0,2,2,1,2,6,0,0,0,1,1,0,0,0,0,0,0,0,0,0,0,0,0,0,0,0
14,15,Nicaragua,2012,86.88,La Esperanza,6.51,15500.24,Orsir Coffee for TiSCA (Taiwan International Specialty Coffee Association),Salatiel De Jeús Zavala Ferrufino,1300.0,Dipilto-Las Manos,Nueva Segovia,others_process,0,0,0,0,0,0,1,2,0,1,1,4,0,0,1,0,0,0,0,0,0,0,1,0,0,0,0,0,0,0,0,0
15,16,Nicaragua,2012,86.66,Los Granadillos,6.2,15172.21,"Wataru & Co., Ltd.",Francisco Ponce Duarte,1300.0,Macuelizo-Brujil,Nueva Segovia,others_process,0,0,0,1,0,0,0,0,1,5,1,5,0,0,0,0,1,1,0,0,0,0,1,0,0,0,0,0,0,0,0,0
16,17,Nicaragua,2012,86.63,La Ampliación,7.15,16551.18,Oren’s Daily Roast,Maycon Yader Montenegro López,1400.0,Dipilto-El Volcán,Nueva Segovia,washed,0,0,0,0,0,0,0,2,2,0,1,1,0,0,0,1,0,0,0,0,0,0,0,0,0,0,0,0,0,0,0,0
17,18,Nicaragua,2012,86.16,Buena Vista/ San José,4.9,11666.85,"Nippon Coffee Trading Co.,Ltd",Miguel Ángel Calderón Córdoba/ Santos Roque Martinez Castro,1400.0,San Fernando-El Ural,Nueva Segovia,washed,0,0,0,1,0,0,0,0,2,3,1,9,1,0,3,0,0,0,0,0,0,0,1,0,0,0,0,0,0,0,0,0
18,19,Nicaragua,2012,86.09,La Fuente,5.4,12857.35,honuKATOCOFFEE Inc.,Norma Elena Marin Grádiz,1200.0,Dipiplto-El Volcán,Nueva Segovia,others_process,0,0,0,0,0,0,0,1,4,2,0,2,0,0,0,1,3,0,0,0,0,0,1,0,0,0,0,0,0,0,0,0
19,20,Nicaragua,2012,85.91,La Picona,6.0,16666.92,"Trabocca, Åre Kafferosteri",Olga Marina González Cuadra,1300.0,Nueva Segovia,"Las Manos, Dipilto, Nueva Segovia",washed,0,1,0,0,1,0,0,1,3,2,1,3,0,0,0,0,1,0,0,0,0,0,0,0,0,0,0,0,0,0,0,0
20,21,Nicaragua,2012,85.88,La Laguna,5.7,13194.65,Silo Coffee Store,Luis Emilio Valladarez,1200.0,Dipilto-La Laguna,Nueva Segovia,others_process,1,0,0,0,1,0,0,0,3,3,1,4,0,0,0,2,0,0,0,0,0,0,1,0,0,0,0,0,0,0,0,0
21,22,Nicaragua,2012,85.63,El Pinabety,6.0,17460.6,D R Wakefield,Porfirio Sauceda Valladarez,1350.0,Dipilto-Las Manos,Nueva Segovia,others_process,0,0,0,0,0,1,1,1,3,2,1,2,2,0,0,0,3,0,0,0,0,0,1,1,0,0,0,0,0,0,0,1
22,23,Nicaragua,2012,85.5,Santa Prisca,6.51,20667.04,Kaffebrenneriet a,Leonel De Jesús Rodriguez Valladarez,1250.0,Dipilto-Buenos Aires,Nueva Segovia,washed,0,0,0,0,0,0,0,2,2,2,0,5,0,0,2,0,0,0,0,0,0,0,0,0,0,0,0,0,0,0,0,0
23,24,Nicaragua,2012,85.47,San José,5.8,13426.13,"Wataru & Co., Ltd.",Erwin Remigio Mierish Buitrago - R.L. Pedro José Solis Martinez,1350.0,Jinotega-Lipululu,Jinotega,others_process,0,1,0,0,0,0,0,1,1,2,3,8,0,0,1,0,1,0,0,0,0,0,0,0,0,0,0,0,0,0,0,0
24,25,Nicaragua,2012,85.34,El Socorro,4.91,17536.02,Atlantic Specialty Coffee,Ageth Enrique Chavarria - R.L. Fátima Ismael Espinoza,1015.0,Jinotega- Mancotal,Jinotega,others_process,1,0,0,1,0,0,0,0,3,2,4,3,0,0,2,0,0,0,0,0,0,0,1,0,0,0,0,0,0,0,0,0
25,1,Nicaragua,2014,90.37,La Dueña,21.2,33453.6,"Maruyama Coffee, Itoya Coffee, Coffee A Go Go, Saza Coffee",Jenny Lourdes Bustamante Moncada,1300.0,Dipilto,Nueva Segovia,others_process,0,0,0,1,1,1,1,0,4,3,0,2,0,0,0,3,1,0,0,0,0,0,0,0,0,0,0,0,0,0,0,0
26,2,Nicaragua,2014,90.1,El Naranjo Dipilto,13.1,21890.1,"GSC International Co., Ltd. (KOREA) // Shanghai Borong International Trading Co., Ltd (CHINA)",Luis Emilio Valladarez,1100.0,Dipilto,Nueva Segovia,others_process,0,1,0,0,0,1,0,1,2,1,2,6,0,2,1,1,0,0,0,0,0,0,1,0,0,0,0,0,0,0,0,0
27,3,Nicaragua,2014,89.73,Fila Alta,15.2,19456.0,"Kean Coffee, Klatch Coffee, Bird Rock Coffee",Henry Alexander Marin,1600.0,Mozonte,Nueva Segovia,others_process,0,1,0,0,0,1,0,2,1,4,0,4,0,1,0,0,0,0,0,0,0,1,0,0,0,0,0,0,0,0,0,0
28,4,Nicaragua,2014,89.03,Ojo de Agua,12.0,19020.0,"Time’s Club, Honey Coffee, Coffee Libre and Proud Mary",Ali Francisco Herrara Rivera,1600.0,Mozonte,Nueva Segovia,others_process,1,0,0,0,0,0,0,0,4,4,2,2,0,1,0,2,0,0,0,0,0,0,1,0,0,0,0,0,0,0,0,0
29,5,Nicaragua,2014,88.73,Los Congos,11.7,20124.0,Terarosa Coffee (S. Korea),José René Paguaga Midense,1700.0,San Fernando,Nueva Segovia,others_process,0,0,1,0,0,1,0,0,0,3,1,4,0,0,0,1,0,0,0,0,1,0,0,0,0,0,0,0,0,0,0,0
30,6,Nicaragua,2014,88.67,Las Brumas,9.6,13584.0,CAFFE PASCUCCI S.p.A.,Rina Liseth Paguaga Buitrago,1450.0,San Fernando,Nueva Segovia,others_process,0,0,0,1,0,0,1,0,3,4,1,2,0,0,2,1,0,0,0,0,1,0,0,0,0,0,0,0,0,0,0,0
31,7,Nicaragua,2014,88.63,Cerro de Jesus,9.1,19100.9,"TOA COFFEE Co.,Ltd & ARAB COFFEE Co.,Ltd","Jesus Mountain Coffee Co., S.A. RL: Octavio Peralta Paguaga",1300.0,Dipilto,Nueva Segovia,others_process,1,0,0,0,0,1,0,0,2,4,1,7,0,0,0,2,0,0,0,0,0,0,1,0,0,0,0,0,0,0,0,0
32,8,Nicaragua,2014,87.93,Bella Aurora,9.6,11721.6,Gamsung international coffea coffee Inc.,Joaquin Agusto Lovo López,1450.0,Dipilto,Nueva Segovia,others_process,0,0,0,0,0,0,0,0,5,4,2,4,0,2,0,1,0,0,0,0,0,0,1,0,0,0,0,0,0,0,0,0
33,9,Nicaragua,2014,87.7,El Janeiro,9.7,20913.2,Kyokuto Fadie Corporation,Alfredo Arauz Siles,1200.0,San Rafael Del Norte,Jinotega,others_process,0,0,0,0,0,1,0,0,0,1,0,0,0,0,0,2,1,0,0,0,0,1,0,0,0,0,0,0,0,0,0,0
34,10,Nicaragua,2014,87.67,La Renovacion,8.7,13041.3,"TASHIRO COFFEE Co.,Ltd",Keyner Antonio Davila Tellez,1280.0,Jinotega,Jinotega,others_process,1,1,0,0,0,0,0,0,3,4,1,2,0,1,0,1,0,0,0,0,0,0,0,0,0,0,0,0,0,0,0,0
35,11,Nicaragua,2014,87.17,El Recuerdo / La Esperanza,8.5,26571.0,"Orsir Coffee (Taiwan), TRN (Taiwan Roasters Network）",Jose Javier Gonzalez Lopez / Carlos Alexander Lopez Pastrana,1400.0,Mozonte,Nueva Segovia,others_process,1,0,0,1,0,1,0,0,1,0,0,10,0,0,0,1,0,0,0,0,0,0,0,0,0,0,0,0,0,0,0,0
36,11,Nicaragua,2014,87.17,Buenos Aires,10.3,16510.9,Kaffebrenneriet as,Carlos Alberto Bendaña Albir,1300.0,Dipilto,Nueva Segovia,others_process,0,0,0,1,0,1,0,0,1,2,0,6,0,1,0,0,0,0,0,0,0,0,0,0,0,0,0,0,0,0,0,0
37,13,Nicaragua,2014,86.73,El Bosque,8.4,16220.4,"Cafe DAZAC, Cafe D, Coffee Sallim Factory, BeanStore, Crema Costa",Julio Peralta Salomon,1398.0,Ocotal,Nueva Segovia,others_process,0,0,0,0,0,1,0,0,3,2,1,3,0,0,0,1,0,0,0,0,0,1,0,0,0,0,0,0,0,0,0,0
38,14,Nicaragua,2014,86.47,Buenos Aires,8.35,13585.45,"ECOM Japan Limited for Bontain Coffee, VOILA Coffee, Ocami Coffee Roasters, NOZY COFFEE",Luis Emilio Valladarez,1300.0,Nueva Segovia,"Las Manos, Dipilto, Nueva Segovia",others_process,0,0,0,0,1,0,0,0,1,0,2,7,1,0,0,1,0,0,0,0,0,0,1,0,0,0,0,0,0,0,0,0
40,16,Nicaragua,2014,86.13,La Picona,8.3,18301.5,"Wataru & Co., Ltd.",Olga Marina González Cuadra,1300.0,Nueva Segovia,"Las Manos, Dipilto, Nueva Segovia",others_process,0,0,0,0,0,1,0,0,2,2,2,5,0,0,0,0,0,0,0,0,0,0,1,0,0,0,0,0,0,0,0,0
41,17,Nicaragua,2014,86.03,El Diamante,8.5,12894.5,La Colombe Torrefaction,William de Jesus Villagra Gutierrez,1250.0,Jalapa,Nueva Segovia,others_process,0,1,0,0,0,1,0,1,1,1,2,6,0,1,2,0,2,0,0,0,0,0,1,0,0,0,0,0,0,0,0,0
42,18,Nicaragua,2014,85.97,Ojo De Agua,8.4,14406.0,"Wataru & Co., Ltd.",Luis Emilio Valladarez,1600.0,Dipilto-Los Mares,Nueva Segovia,others_process,0,1,0,1,1,1,0,0,3,0,0,1,0,0,0,0,0,0,0,0,0,0,1,0,0,0,0,0,0,0,0,0
43,19,Nicaragua,2014,85.93,Santa María de Lourdes,8.1,10764.9,NAGAHAMA COFFEE Inc.,Octavio José Peralta Paguaga,1450.0,Nueva Segovia,"Bayancun, San Fernando, Nueva Segovia",others_process,0,0,0,1,1,1,0,1,1,2,0,3,0,0,2,0,2,0,0,0,0,0,1,0,0,0,0,0,0,0,0,0
44,20,Nicaragua,2014,85.83,Las Carmelitas,8.0,32032.0,"Nippon Coffee Trading Co.,Ltd",Vilma del Socorro Tellez Ballasteros,1250.0,Jinotega,Jinotega,others_process,0,0,0,1,0,0,0,2,3,4,2,2,0,0,2,1,1,0,0,0,0,0,0,0,0,0,0,0,0,0,0,0
45,21,Nicaragua,2014,85.53,La Cascada,10.2,14932.8,"Caravela Coffee for Krankies Coffee, Metropolis Coffee, Roast, Inc. (USA), Marvell Street (AUS), Holly Brown (Hong Kong)",Genaro Herrera,1300.0,San Fernando,Nueva Segovia,others_process,0,0,0,1,1,0,0,0,3,1,0,3,1,0,0,1,0,0,0,0,0,0,1,0,0,0,0,0,0,0,0,0
46,22,Nicaragua,2014,85.47,Las Golondrinas,8.1,12984.3,"Wataru & Co., Ltd.",Rodrigo Peralta Paguaga,1600.0,Mozonte,Nueva Segovia,others_process,0,0,1,0,0,0,0,0,2,1,1,3,0,0,0,1,0,0,0,0,0,0,1,0,0,0,0,0,0,0,0,0
47,23,Nicaragua,2014,85.43,Santa Adelaida,7.7,14137.2,Campos Coffee,Marco Tulio Bendaña Espinoza,1200.0,Dipilto,Neuva Segovia,others_process,0,0,0,1,0,0,0,0,0,3,1,6,0,0,0,1,0,0,0,0,0,0,0,0,0,0,0,0,0,0,0,0
48,24,Nicaragua,2014,85.17,La Argentina,8.1,17074.8,Lofbergs Lila AB,Roger Peralta Mantilla,1200.0,Dipilto,Nueva Segovia,others_process,0,0,0,0,0,1,0,1,1,0,0,1,0,0,0,2,1,0,0,0,0,1,0,0,0,0,0,0,0,0,0,0
49,25,Nicaragua,2014,85.13,La Esperanza,7.6,16887.2,honuKATOCOFFEE Inc.,Salatiel De Jeús Zavala Ferrufino,1300.0,Dipilto-Las Manos,Nueva Segovia,others_process,1,0,0,0,0,0,0,2,4,3,0,3,1,0,0,0,0,0,0,0,0,0,1,0,0,0,0,0,0,0,0,0
50,1,Nicaragua,2015,89.69,Buenos Aires (2015),21.6,32680.8,"Time’s Club, Kyokuto Fadie, Tashiro Coffee, TOA coffee, HoneyCoffee (JAPAN) // Coffee Libre (KOREA)",Luis Emilio Valladarez,,Dipilto,Nueva Segovia,others_process,0,1,1,0,0,0,0,0,0,2,1,3,1,0,1,1,1,0,0,0,0,0,0,0,0,0,0,0,0,0,0,0
51,2,Nicaragua,2015,89.35,La Picona 2015,11.0,14553.0,"Maruyama Coffee, Yokoi Coffee, Adachi Coffee, Yamada Coffee",Olga Marina Gonzalez Cuadra,,Dipilto,Nueva Segovia,others_process,0,0,0,0,0,1,0,0,0,0,0,6,0,0,0,1,0,0,0,0,0,0,0,0,0,0,0,0,0,0,0,0
52,3,Nicaragua,2015,89.27,Los Altos,10.0,15670.0,Campos Coffee,"Palta, S.A (Fincas Mierisch)",,Matagalpa,Matagalpa,others_process,0,1,0,0,0,0,0,0,1,2,0,4,0,0,0,1,0,0,0,0,0,0,0,0,0,0,0,0,0,0,0,0
53,4,Nicaragua,2015,88.96,La Esperanza,6.2,7173.4,Bewleys Coffee,Carlos Alexander Lopez Pastrana,,Mozonte,Nueva Segovia,others_process,1,0,0,1,0,1,0,0,1,1,0,4,0,0,1,1,0,0,0,0,0,0,0,0,0,0,0,0,0,0,0,0
54,5,Nicaragua,2015,88.85,Fila Alta (2015),5.6,9391.2,Campos Coffee,Henry Alexander Marin,,Mozonte,Nueva Segovia,others_process,0,1,1,1,0,0,0,0,1,0,5,7,0,0,0,0,0,0,1,0,0,0,0,0,0,0,0,0,0,0,0,0
55,6,Nicaragua,2015,88.73,San Alberto,4.7,8680.9,"GSC International Co., Ltd. (KOREA) // Shanghai Borong International Trading Co., Ltd (CHINA)",Martha Delfina Ash,,Jinotega,Jinotega,others_process,1,0,0,0,0,0,0,0,1,6,0,3,0,0,0,1,0,0,0,0,0,0,0,0,0,0,0,0,0,0,0,0
56,7,Nicaragua,2015,88.54,La Ventaja,6.0,7740.0,"UCC Ueshima Coffee Co., Ltd.",Sergio Jose Paguaga Gonzalez,,Dipilto,Nueva Segovia,others_process,0,0,0,0,0,0,0,0,1,0,1,5,1,0,2,1,0,0,0,0,0,0,0,0,0,0,0,0,0,0,0,0
57,8,Nicaragua,2015,88.19,Las Nubes (2015),7.7,18264.4,UCC Ueshima Coffee Co. UK,Carlos Alberto Bendaña Albir,,Dipilto,Nueva Segovia,others_process,0,0,0,0,0,1,0,0,1,1,1,4,0,0,1,1,0,0,0,0,0,0,0,0,0,0,0,0,0,0,0,0
58,9,Nicaragua,2015,88.08,Agropecuaria Santa Maura,4.4,7972.8,"GSC International Co., Ltd. (KOREA) // Shanghai Borong International Trading Co., Ltd (CHINA)","Agropecuaria Santa Maura, S.A.",,Jinotega,Jinotega,others_process,0,1,0,1,0,0,0,0,1,1,0,5,0,0,0,0,0,0,1,0,0,0,0,0,0,0,0,0,0,0,0,0
59,10,Nicaragua,2015,87.96,La Carolina (2015),4.2,5972.4,WATARU for OGAWA COFFEE,Andres Figueroa Lopez,,Dipilto,Nueva Segovia,others_process,0,0,0,1,0,1,0,0,0,0,1,5,1,0,0,1,0,0,0,0,0,0,0,0,0,0,0,0,0,0,0,0
60,11,Nicaragua,2015,87.31,Linda Vista (2015),4.3,6389.8,UCC Ueshima Coffee Co. UK,Antonio Galo Sanchez,,Dipilto,Nueva Segovia,others_process,0,1,0,0,0,1,0,0,1,1,0,5,0,0,1,1,0,0,0,0,0,0,0,0,0,0,0,0,0,0,0,0
61,11,Nicaragua,2015,87.31,La Estacion (2015),7.0,5096.0,Mercanta the Coffeehunters (UK) // Den Gyldne Bonne (NORWAY),Universidad CentroAmericana (UCA),,Jinotega,Jinotega,others_process,1,0,0,0,0,0,0,0,1,0,2,6,2,0,1,1,1,0,0,0,0,0,0,0,0,0,0,0,0,0,0,0
62,13,Nicaragua,2015,87.08,San Jose (2015),6.0,8928.0,Kyokuto Fadie Corporation,Eudoro Jose Guillen Jarquin,,Dipilto,Nueva Segovia,others_process,0,1,0,1,0,0,0,0,0,1,1,4,1,0,0,1,0,0,1,0,0,0,0,0,0,0,0,0,0,0,0,0
63,14,Nicaragua,2015,87.0,El Roble (2015),4.0,4232.0,"Wataru & Co., Ltd.",Yojana Azucena Figueroa Gonzalez,,Dipilto,Nueva Segovia,others_process,0,0,0,1,0,0,0,1,2,1,1,4,0,0,0,0,0,0,0,0,0,0,0,0,0,0,0,0,0,0,0,0
64,15,Nicaragua,2015,86.96,Santa Fe,4.1,6715.8,"GSC International Co., Ltd. (KOREA) // Shanghai Borong International Trading Co., Ltd (CHINA)",Inagrosa,,San Rafael del Norte,Jinotega,others_process,0,0,0,1,0,0,0,0,2,2,3,4,0,0,0,1,0,0,1,0,0,0,0,0,0,0,0,0,0,0,0,0
65,16,Nicaragua,2015,86.88,El Suyatal,4.4,6353.6,Ecom Japan Limited,Luis Emilio Valladarez,,Macuelizo,Nueva Segovia,others_process,0,0,0,0,0,1,0,0,1,1,1,7,1,0,1,1,0,0,1,0,0,0,0,0,0,0,0,0,0,0,0,0
66,16,Nicaragua,2015,86.88,San Jorge (2015),6.9,9556.5,"Wataru & Co., Ltd.",Elisa Maria Callejas Lopez (Ramacafe),,Tuma - La Dalia,Matagalpa,others_process,0,0,0,0,0,1,0,0,1,0,0,5,1,2,0,0,2,0,0,0,0,0,0,0,0,0,0,0,0,0,0,0
67,18,Nicaragua,2015,86.73,La Escondida,4.1,5153.7,"TASHIRO COFFEE Co.,Ltd",Mario Jose Vilchez Urbina,,Mozonte,Nueva Segovia,others_process,0,0,0,0,0,1,0,0,2,1,0,4,0,0,0,1,0,0,0,0,0,0,0,0,0,0,0,0,0,0,0,0
68,19,Nicaragua,2015,86.69,El Barril,10.3,17376.1,"Caravela Coffee for Passenger Coffee, Vigilante Coffee, Boston Stoker (USA) // Holly Brown (HONG KONG)",Francisco Javier Valle Garcia,,San Fernando,Nueva Segovia,others_process,0,0,0,0,1,0,0,2,0,0,0,3,0,0,1,0,0,0,0,0,0,0,0,0,0,0,0,0,0,0,0,0
69,20,Nicaragua,2015,86.58,El Ojo de Agua / Finca San…,4.0,4576.0,Maruyama Coffee,Ali Francisco Herrera Rivera / Liseth Del Carmen Herrera Rivera,,Mozonte,Nueva Segovia,others_process,0,0,0,1,0,0,0,0,0,2,0,4,0,0,1,0,0,0,0,0,0,0,0,0,0,0,0,0,0,0,0,0
70,20,Nicaragua,2015,86.58,Luz y Sombra de Janeiro,4.9,7776.3,MOMOS COFFEE,Alfredo Arauz Siles,,San Rafael del Norte,Jinotega,others_process,1,0,1,0,0,0,0,0,1,1,1,4,0,0,2,1,0,0,1,0,0,0,0,0,0,0,0,0,0,0,0,0
71,22,Nicaragua,2015,86.35,El Mango,4.1,8950.3,"Wataru & Co., Ltd.",Yolanda del Carmen Reyes Gutierrez,,San Juan del Rio Coco,Madriz,others_process,0,1,0,0,0,1,0,0,1,3,1,4,0,0,1,1,0,0,0,0,0,0,0,0,0,0,0,0,0,0,0,0
72,23,Nicaragua,2015,86.19,El Porvenir,4.6,4232.0,"WATARU for FRESH ROASTER COFFEE TONYA CO., LTD.",Randolfo Alberto Llanes Lopez,,Dipilto,Nueva Segovia,others_process,0,0,0,1,0,0,0,0,0,1,1,4,0,0,2,1,0,0,0,0,0,0,0,0,0,0,0,0,0,0,0,0
73,24,Nicaragua,2015,86.15,El Recuerdo,4.1,4879.0,"Wataru & Co., Ltd.",Henry Antonio Herrera Rivera,,Mozonte,Nueva Segovia,others_process,0,0,0,0,0,1,0,0,2,0,0,4,1,0,1,1,0,0,1,0,0,0,0,0,0,0,0,0,0,0,0,0
74,25,Nicaragua,2015,86.12,El Cedro,4.1,9167.6,"RYANS COFFEE ROASTERS, Cafe Nara, CAFE Q, LK ESPRESSO, ACID BROWN COFFEE, BROWNHOLIC COFFEE ROASTERS, BERRY BEANS, S.W Park",Maria Auxiliadora Gonzalez,,San Juan del Rio Coco,Madriz,others_process,0,0,1,1,0,0,0,0,1,1,0,5,0,0,2,1,0,0,0,0,0,0,0,0,0,0,0,0,0,0,0,0
75,25,Nicaragua,2015,86.12,La Bendicion,4.6,5322.2,honuKATOCOFFEE Inc.,Luis Alberto Balladarez Moncada,,Jalapa,Nueva Segovia,others_process,0,1,0,0,0,0,0,0,1,0,0,6,0,0,0,0,0,0,0,0,0,0,0,0,0,0,0,0,0,0,0,0
76,27,Nicaragua,2015,86.04,Las Neblinas,4.1,6461.6,Kaffebrenneriet as,Carlos Alberto Cruz Lopez,,Jalapa,Nueva Segovia,others_process,0,0,0,1,0,0,0,0,1,0,0,5,0,0,0,0,0,0,0,0,0,0,0,0,0,0,0,0,0,0,0,0
77,28,Nicaragua,2015,86.0,La Cascada,4.0,5772.0,"Wataru & Co., Ltd.",Luis Alberto Peralta Mantilla,,Dipilto,Nueva Segovia,others_process,0,1,0,0,0,0,0,0,3,1,0,1,0,0,0,1,0,0,0,0,0,0,0,0,0,0,0,0,0,0,0,0
78,29,Nicaragua,2015,85.88,San Salvador,4.0,5812.0,"Cafe DAZAC, Coffee Sallim Factory, Juk-dong Cafe D, Crema Costa, Beanstore(Buchon)",Luis Emilio Valladarez,,Dipilto,Nueva Segovia,others_process,0,0,0,0,0,0,0,0,1,1,1,5,0,0,1,2,0,0,0,0,0,0,0,0,0,0,0,0,0,0,0,0
79,30,Nicaragua,2015,85.77,Volcancito (2015),4.0,9524.0,"Cafe DAZAC, Coffee Sallim Factory, Juk-dong Cafe D, Crema Costa, Beanstore(Buchon)",Rogelio Ramon Guitterez,,Jinotega,Jinotega,others_process,0,0,0,0,0,0,0,0,3,3,1,1,1,0,0,1,0,0,0,0,0,0,0,0,0,0,0,0,0,0,0,0
80,30,Nicaragua,2015,85.77,Las Cumbres,4.1,5965.5,"Nippon Coffee Trading Co.,Ltd",Walter Jose Picado Perez,,Limay,Esteli,others_process,0,1,0,0,0,1,0,0,2,1,0,4,0,0,0,2,0,0,0,0,0,0,0,0,0,0,0,0,0,0,0,0
81,32,Nicaragua,2015,85.54,Flor Silverstre,4.9,6159.3,MOMOS COFFEE,Maria Elisa Ortez Siles,,San Fernando,Nueva Segovia,others_process,0,0,0,0,0,0,0,0,4,1,0,2,0,0,1,1,0,0,0,0,0,0,0,0,0,0,0,0,0,0,0,0
82,33,Nicaragua,2015,85.35,El Naranjo,4.1,5342.3,MOMOS COFFEE,Pedro Pablo Paguaga Nuñez,,Dipilto,Nueva Segovia,others_process,0,0,0,0,0,1,0,0,0,2,0,4,0,0,1,1,0,0,0,0,0,0,0,0,0,0,0,0,0,0,0,0
83,34,Nicaragua,2015,85.08,La Laguna (2015),4.0,5556.0,Ecom Japan Limited,Luis Emilio Valladarez,,Dipilto,Nueva Segovia,others_process,0,0,0,0,0,1,0,0,1,2,0,3,0,0,0,0,0,0,0,0,0,0,0,0,0,0,0,0,0,0,0,0
84,34,Nicaragua,2015,85.08,El Coco,4.1,4473.1,Carrboro Coffee Roasters,Jose Agustin Fortin Altamirano,,San Juan del Rio Coco,Madriz,others_process,0,1,0,0,0,0,0,1,2,2,0,1,0,0,0,1,0,0,0,0,0,0,0,0,0,0,0,0,0,0,0,0
85,36,Nicaragua,2015,85.04,Loma Verde,4.0,4496.0,"GSC International Co., Ltd. (KOREA) // Shanghai Borong International Trading Co., Ltd (CHINA)",Elitt Castellon Rodriguez,,Jalapa,Nueva Segovia,others_process,0,0,0,0,0,0,0,0,3,1,0,3,0,0,0,0,0,0,0,0,0,0,0,0,0,0,0,0,0,0,0,0
86,1,Nicaragua,2017,91.16,El Esfuerzo 2017,40.3,22523.67,"Maruyama Coffee, Toa Coffee, Sarutahiko Coffee, Difference Coffee Co. (UK).",Ignacio Estrada Burgo,,Jinotega,Jinotega,washed,1,0,1,0,0,1,0,0,4,0,0,4,1,0,1,0,1,0,1,0,0,0,1,0,0,0,0,0,0,0,0,0
87,1,Nicaragua,2017,91.16,El Esfuerzo 2017,37.9,20052.89,Wataru for SHRUB COFFEE,Ignacio Estrada Burgo,,Jinotega,Jinotega,washed,1,0,1,0,0,1,0,0,4,0,0,4,1,0,1,0,1,0,1,0,0,0,1,0,0,0,0,0,0,0,0,0
88,2,Nicaragua,2017,90.5,Las Promesas de San Blas 2017,15.0,11904.75,"Time’s Club, Inc. , Coffee Libre",Gonzalo Adán Castillo Moreno,,Dipilto,Nueva Segovia,honey,0,1,1,0,0,1,0,1,2,0,0,8,0,2,0,0,0,1,1,0,0,0,0,0,0,0,0,0,0,0,0,0
89,2,Nicaragua,2017,90.5,Las Promesas de San Blas 2017,15.0,11408.85,"Maruyama Coffee Co., Ltd.",Gonzalo Adán Castillo Moreno,,Dipilto,Nueva Segovia,honey,0,1,1,0,0,1,0,1,2,0,0,8,0,2,0,0,0,1,1,0,0,0,0,0,0,0,0,0,0,0,0,0
90,3,Nicaragua,2017,90.37,Bella Aurora 2017,16.1,6388.8,MOMOS COFFEE,Luis Joaquin Lovo Gutiérrez,,Dipilto,Nueva Segovia,washed,1,1,0,0,0,0,0,1,1,2,1,4,0,0,0,0,0,0,1,0,0,0,1,0,0,0,0,0,0,0,0,0
91,3,Nicaragua,2017,90.37,Bella Aurora 2017,16.1,5847.2,SUPREMO (Germany),Luis Joaquin Lovo Gutiérrez,,Dipilto,Nueva Segovia,washed,1,1,0,0,0,0,0,1,1,2,1,4,0,0,0,0,0,0,1,0,0,0,1,0,0,0,0,0,0,0,0,0
92,4,Nicaragua,2017,89.87,Las Delicias 2017,16.4,10463.04,Taf Coffee,Eleane Mierisch & Gioconda Padilla,,Jinotega,Jinotega,washed,1,0,0,0,0,0,0,0,2,1,1,6,0,0,1,1,1,0,1,0,0,0,0,0,0,0,0,0,0,0,0,0
93,5,Nicaragua,2017,89.75,Buena Vista 2017,14.2,10323.4,Brew92,Roger Esaú Herrera Ortez,,San Fernando,Nueva Segovia,washed,0,1,1,0,0,1,0,2,1,4,0,7,0,0,1,3,0,0,0,0,0,0,1,0,0,0,0,0,0,0,0,0
94,6,Nicaragua,2017,89.62,La Esperanza 2017,11.5,7432.45,"Pebble Coffee Co., Ltd.",Carlos Alexander López Pastrana,,Mozonte,Nueva Segovia,washed,0,1,1,0,0,0,0,0,4,1,0,6,1,1,0,1,0,0,0,0,0,1,0,0,0,0,0,0,0,0,0,0
95,7,Nicaragua,2017,89.45,La Orquidea 2017,10.37,8916.02,Campos Coffee,Arjen Roersma,,Jinotega,Jinotega,washed,0,0,0,0,0,0,0,0,0,1,0,2,2,1,0,0,1,0,0,0,0,0,1,0,0,0,0,0,0,0,0,0
96,8,Nicaragua,2017,89.08,La Ampliación 2017,8.8,7796.8,Kaffebrenneriet As,Guillermo Montenegro Ayestas,,Dipilto,Nueva Segovia,washed,0,0,0,0,0,1,0,0,3,1,0,5,0,0,0,3,1,0,0,0,0,0,0,0,0,0,0,0,0,0,0,0
97,9,Nicaragua,2017,89.04,El Naranjo Dipilto 2017,9.1,8205.29,Kafema,Luis Emilio Valladarez,,Dipilto,Nueva Segovia,washed,0,0,0,0,0,0,0,0,0,3,1,4,0,0,0,0,0,0,0,0,0,0,1,0,0,0,0,0,0,0,0,0
98,10,Nicaragua,2017,88.58,El Carmen 2017,9.1,7989.8,"UCC Ueshima Coffee Co., Ltd.",Luis Emilio Valladarez,,San Juan Del Rio Coco,Madriz,washed,0,0,0,1,1,0,0,1,6,3,0,4,0,0,0,1,1,0,1,0,0,0,1,0,0,0,0,0,0,0,0,0
99,11,Nicaragua,2017,88.33,Buenos Aires 2017,12.11,12739.72,"Pebble Coffee Co., Ltd.",Luis Emilio Valladarez,,Dipilto,Nueva Segovia,washed,0,0,0,0,0,0,1,0,3,2,0,4,0,1,1,1,2,0,0,0,0,0,1,0,0,0,0,0,0,0,0,0
100,12,Nicaragua,2017,88.12,La Montañita 2017,8.1,7824.6,Wataru for OGAWA COFFEE,Jaime Blandon Rivera,,San Rafael Del Norte,Jinotega,washed,0,0,0,0,0,1,0,0,3,4,0,5,0,0,1,1,0,0,0,0,0,0,0,0,0,0,0,0,0,0,0,0
101,13,Nicaragua,2017,87.91,Un Regalo de Dios 2017,12.11,8009.31,Kyokuto Fadie Corporation,Luis Alberto Balladarez Moncada,,Mozonte,Nueva Segovia,washed,0,0,0,0,0,0,0,0,3,2,2,8,0,0,1,0,1,0,0,0,0,0,1,0,0,0,0,0,0,0,0,0
102,14,Nicaragua,2017,87.83,Ojo de Agua 2017,8.1,7929.9,Ecom Japan Limited,Luis Emilio Valladarez,,Dipilto,Nueva Segovia,washed,0,0,0,0,0,0,0,0,3,0,0,6,0,0,0,1,1,0,0,0,0,0,1,0,0,0,0,0,0,0,0,0
103,15,Nicaragua,2017,87.79,Ojo de Agua 2017,8.25,11673.75,Solberg & Hansen As,Juan Ramón Diaz Suárez,,Dipilto,Nueva Segovia,honey,0,0,0,0,0,0,1,0,2,0,0,4,0,1,0,2,0,1,1,0,0,0,0,0,0,0,0,0,0,0,0,0
104,16,Nicaragua,2017,87.79,El Ciprez 2017,11.1,8442.55,Brew92,Isabel Eugenia Albir Arguello,,Dipilto,Nueva Segovia,natural,1,0,0,0,0,1,0,0,2,0,2,6,1,0,0,2,0,0,0,0,0,0,1,0,0,0,0,0,0,0,0,0
105,17,Nicaragua,2017,87.75,La Laguna 2017,7.5,6688.35,"Wataru & Co., Ltd",Luis Emilio Valladarez,,Dipilto,Nueva Segovia,washed,0,0,0,0,0,0,0,0,1,2,0,5,0,0,2,1,0,0,0,0,0,0,1,0,0,0,0,0,0,0,0,0
106,18,Nicaragua,2017,87.7,La Tormenta 2017,7.2,7250.4,Honu Kato Coffee Inc.,Francisco Irene Olivera Ruiz,,Dipilto,Nueva Segovia,washed,1,0,1,0,0,0,0,0,3,4,0,3,0,0,0,1,1,0,0,0,0,0,1,0,0,0,0,0,0,0,0,0
107,19,Nicaragua,2017,87.45,La Divina Providencia 2017,7.82,6465.03,"List & Beisler GmbH Hamburg, Tres Cabezas Berlin",Misael Sauceda Olivera,,Dipilto,Nueva Segovia,washed,0,0,1,1,0,0,1,0,3,3,0,4,1,1,0,2,0,0,0,0,0,0,0,0,0,0,0,0,0,0,0,0
108,20,Nicaragua,2017,86.66,San Jose 2017,7.6,5277.82,"Wataru & Co., Ltd","MIMC S,A",,Jinotega,Jinotega,honey,0,0,0,0,0,0,1,0,4,1,1,3,0,1,0,1,0,0,0,0,0,0,0,0,0,0,0,0,0,0,0,0
109,21,Nicaragua,2017,86.62,Santa Maria 2017,8.71,20162.17,"Pebble Coffee Co., Ltd.",Victor Manuel Robelo Rodriguez,,Matagalpa,Matagalpa,natural,0,0,0,0,1,1,0,0,1,0,0,5,0,1,0,1,1,0,0,0,0,1,0,0,0,0,0,0,0,0,0,0
110,22,Nicaragua,2017,86.58,Agropecuaria el Cielo 2017,7.1,17600.9,"Wataru & Co., Ltd",Agropecuaria El Cielo,,El Tuma La Dalia,Matagalpa,washed,0,0,0,1,0,1,0,0,1,1,0,5,0,0,1,0,1,0,0,0,0,0,0,0,0,0,0,0,0,0,0,0
111,23,Nicaragua,2017,86.37,Santa Rita 2017,7.11,5602.68,"Wataru & Co., Ltd",Roberto Carlos Castellanos Rodriguez,,Dipilto,Nueva Segovia,washed,0,1,0,0,1,1,0,0,4,4,0,1,0,0,0,1,1,0,0,0,0,0,1,0,0,0,0,0,0,0,0,0
112,24,Nicaragua,2017,86.16,Santa Teresa 2017,7.8,6447.79,Vigilante Coffee Company,Joaquin Augusto Lovo López,,Dipilto,Nueva Segovia,washed,0,0,0,0,0,0,1,0,2,0,0,6,0,0,0,1,1,0,1,0,0,0,1,0,0,0,0,0,0,0,0,0
